2020-01-05,Checking or savings account,Other banking product or service,Managing an account,Problem accessing account,"I wrote to U.S. Bank ( formerly XXXX XXXX  ) to ascertain whether my deceased husband, XXXX XXXX XXXX, had any safe deposit boxes or accounts with their bank. I sent U.S. Bank 's Legal Department my Letters of Office as Administrator of the Estate of XXXX XXXX XXXX, Deceased, in XXXX County Probate Court, XXXX XXXX XXXX as well as the Certified Death Certificate. Ms. XXXX XXXX of U.S. Bank Omnichannel Customer Service responded on XX/XX/XXXX, never stating that U.S. did or did not have an account in my deceased husband 's name, but requesting that I provide them with a "" valid account number '' in order to process my request. My husband 's social security number is on his death certificate, and I told Ms. XXXX that this is the United States of America and that accounts are not tracked in the U.S. by account number only, as in a XXXX XXXX   account, and that she could locate any account for my husband by his name as he was the ony XXXX XXXX XXXX in the State of Illinois and likely in the country. I called U.S. Bank 's 800 number and was told they would file a report with their "" Life Events Department '' who would be in touch with me. By taking me in circles, I believe U.S. Bank may have released the contents of my husband 's safe deposit box or accounts to someone else who was not entitled to it, i.e., possibly his daughter, XXXX XXXX, who is co-heir with me to her father 's estate. I need straight answers from U.S. Bank rather than being taken in circles with them requesting a valid account number. They never said, "" We do not have an account at all for XXXX XXXX XXXX ''. I have provided the proper documentation and could provide a subpoena for their records if necessary through my Probate Attorneys, but I have spent thousands already in legal fees and only want a bona fide answer as to whether U.S. Bank has accounts or safe deposit boxes in my husband 's name.",Company has responded to the consumer and the CFPB and chooses not to provide a public response,U.S. BANCORP,IL,60617,Older American,Consent provided,Web,2020-01-10,Closed with explanation,Yes,,3485730,write bank xxxx xxxx ascertain deceased husband xxxx xxxx xxxx safe deposit box account bank send bank legal department letter office administrator estate xxxx xxxx xxxx deceased xxxx county probate court xxxx xxxx xxxx certify death certificate ms xxxx xxxx bank omnichannel customer service respond xx xx xxxx state account deceased husband request provide valid account number order process request husband social security number death certificate tell ms xxxx united states america account track account number xxxx xxxx account locate account husband ony xxxx xxxx xxxx state illinois likely country call bank number tell file report life event department touch take circle believe bank release content husband safe deposit box account entitle possibly daughter xxxx xxxx co heir father estate need straight answer bank take circle request valid account number say account xxxx xxxx xxxx provide proper documentation provide subpoena record necessary probate attorney spend thousand legal fee want bona fide answer bank account safe deposit box husband,1
2016-05-07,Debt collection,Medical,False statements or representation,Attempted to collect wrong amount,"I received a letter dated XXXX XXXX, XXXX from Monterey Collections ( XXXX XXXX XXXX XXXX, XXXX, XXXX XXXX, XXXX Account No : XXXX ), stating that I owed {$2400.00} for laboratory work performed by XXXX XXXX XXXX , XXXX. 

My physician, XXXX XXXX, XXXX, who has been my doctor since XX/XX/XXXX, recommended this lab because of the broader range of testing they perform. 
I informed XXXX XXXX that my insurance plan requires that I utilize lab services at XXXX XXXX XXXX XXXX for coverage. He assured me I would not be responsible for any charges even if my insurance did not cover these services. He had previously explained this in similar fashion to my husband who used these services. Our insurance may a partial payment and the lab wrote-off the balance, as was stated to him by XXXX XXXX and the laboratory on the day of the blood draw. 

When I reported to the lab 's local draw-site I restated my concerns of coverage before any XXXX and was reassured that I was not responsible for any charges, and that I would not be billed. XXXX is part of my XXXX and is covered by insurance. The collection date was XXXX/XXXX/XXXX. 

On XXXX XXXX, XXXX, received the above noted letter from Monterey Collections and I immediately called them with the previously stated explanation. The representative made the statement that the doctor sent me there because he receives a kickback from the lab ( her statement, not mine ) and regardless, I still owe {$2400.00}. She also stated that the sales reps lie and asked if I had the statements in writing, which I do not. I was told by my doctor that the lab takes what insurance pays and there is no further charge. I had no reason to believe my physician was not being truthful. I am quite sure he was told by this laboratory that this was their policy. I went to this lab in good faith, and furthermore, I checked with them again on their policy at that time and I was told the same information. If there was a policy change, it should have been posted at the laboratory draw center and I should have been informed at that time. 

In my opinion, I believe I am a victim of fraud. Fraud in health care is defined as an "" intentional act '' of deception or misrepresentation. I very clearly stated my concerns regarding using this lab and was reassured that I would not be responsible for any charges. Furthermore, I never received any bill for this service until now, 16 months later, and that bill is from Monterey Collections. I have additional concerns that my credit rating will be tarnished and this may affect my ability to transact business in the future. I am extremely concerned my good name has been potentially damaged. 

Please investigate XXXX XXXX XXXX , XXXX, XXXX XXXX XXXX XXXX, XXXX XXXX XXXX XXXX XXXX XXXX, XXXX, XXXX XXXX, XXXX. Attached is the letter I received from the Collection Agency. 

I believe there are many other victims of this laboratory 's deception. 


Respectfully, XXXX XXXX XXXX XXXX XXXX XXXX XXXX XXXX. 
XXXX, XXXX XXXX XXXX",Company believes it acted appropriately as authorized by contract or law,Monterey Financial Services LLC,CA,937XX,Older American,Consent provided,Web,2016-05-07,Closed with explanation,Yes,No,1914933,receive letter date xxxx xxxx xxxx monterey collection xxxx xxxx xxxx xxxx xxxx xxxx xxxx xxxx account xxxx state owe laboratory work perform xxxx xxxx xxxx xxxx physician xxxx xxxx xxxx doctor xx xx xxxx recommend lab broad range testing perform inform xxxx xxxx insurance plan require utilize lab service xxxx xxxx xxxx xxxx coverage assure responsible charge insurance cover service previously explain similar fashion husband service insurance partial payment lab write balance state xxxx xxxx laboratory day blood draw report lab local draw site restate concern coverage xxxx reassure responsible charge bill xxxx xxxx cover insurance collection date xxxx xxxx xxxx xxxx xxxx xxxx receive note letter monterey collection immediately call previously state explanation representative statement doctor send receive kickback lab statement regardless owe state sale rep lie ask statement writing tell doctor lab take insurance pay charge reason believe physician truthful sure tell laboratory policy go lab good faith furthermore check policy time tell information policy change post laboratory draw center inform time opinion believe victim fraud fraud health care define intentional act deception misrepresentation clearly state concern lab reassure responsible charge furthermore receive bill service month later bill monterey collection additional concern credit rating tarnish affect ability transact business future extremely concerned good potentially damage investigate xxxx xxxx xxxx xxxx xxxx xxxx xxxx xxxx xxxx xxxx xxxx xxxx xxxx xxxx xxxx xxxx xxxx xxxx attach letter receive collection agency believe victim laboratory deception respectfully xxxx xxxx xxxx xxxx xxxx xxxx xxxx xxxx xxxx xxxx xxxx xxxx,1
2017-06-25,Mortgage,Conventional home mortgage,Struggling to pay mortgage,,We fell behind on our payments on our Home Equity Lline of Credit. After several attempts and complaints we were finally modified by our bank. However the modification we signed and our statements are not matching. We modified into a 15 year fixed rate loan with an interest rate of 2.740 %. Beginning balance was to be {$230000.00} which we feel is incorrect and we have sent inquiries on this but to no avail has the bank answered. We feel we were cornered into signing this or we would have lost our house. <P/>We made our 3 trial payments and have been paying monthly since. We are behind a month due to the renter of the property not paying us but the real issue is the way the statements read and issues with the modification itself. Attached is an amoritizattion schedule which was run and the amounts no way match the statements being sent to us. We need to know where every penny went and how it was arrived at. Also we have never received a signed modification by the bank and we signed this modification back in XXXX of 2016. Also this modification was to be recorded. As of today this has not been done. Attached is a copy of a runoff from the County recorder showing no modification recorded.,,PNC Bank N.A.,IL,605XX,,Consent provided,Web,2017-06-25,Closed with explanation,Yes,,2558326,fall payment home equity lline credit attempt complaint finally modify bank modification sign statement match modify year fix rate loan interest rate begin balance feel incorrect send inquiry avail bank answer feel corner sign lose house trial payment pay monthly month renter property pay real issue way statement read issue modification attach amoritizattion schedule run amount way match statement send need know penny go arrive receive sign modification bank sign modification xxxx modification record today attach copy runoff county recorder show modification record,6
2017-07-17,"Credit reporting, credit repair services, or other personal consumer reports",Credit reporting,Problem with a credit reporting company's investigation into an existing problem,Their investigation did not fix an error on your report,"My current credit report lists   XXXX   XXXX   XXXX   XXXX   XXXX   as being 120 past due with 9 missed payments since   XXXX   2016 and in adverse status. I have not MISSED ONE PAYMENT. I have made 31 payments since  XXXX  of 2016 totaling {$18000.00} ( see printout from the state of CT attached ). I called the state of CT and they told me to dispute the credit report with  XXXX . I did and they still did not fix my payment history or account status. They changed the balance, but not my payment history. This mistake is probably bringing my FICO down   XXXX   points.",Company has responded to the consumer and the CFPB and chooses not to provide a public response,Experian Information Solutions Inc.,CT,066XX,,Consent provided,Web,2017-07-17,Closed with explanation,Yes,,2576312,current credit report list xxxx xxxx xxxx xxxx xxxx past miss payment xxxx adverse status miss payment payment xxxx total printout state ct attach call state ct tell dispute credit report xxxx fix payment history account status change balance payment history mistake probably bring fico xxxx point,0
2018-04-06,"Credit reporting, credit repair services, or other personal consumer reports",Credit reporting,Improper use of your report,Reporting company used your report improperly,"This company is not licensed to collect in my state. I'm am a Texas resident and this company is bonded in Kansas. Today, XX/XX/2018, this debt was added to my credit report! I'm furious! Not only because they are illegally trying to collect in my state, but I have NEVER even done business with this company. I don't know who they are! I have worked really hard on my credit and haven't had late payments or new deragatory marks on my credit in YEARS!. The company attempting to collect the debt is NATIONAL CREDIT ADJUST. THEIR address is Creditor Contact : XXXX XXXX XXXX XXXX XXXX XXXX XXXX, XXXX, KS XXXX | ( XXXX ) XXXX. The amount listed is {$830.00}. No one even ever attempted to contact me.",,"National Credit Adjusters, LLC",TX,770XX,,Consent provided,Web,2018-04-06,Closed with explanation,Yes,,2867112,company license collect state texas resident company bond kansas today xx debt add credit report furious illegally try collect state business company know work hard credit late payment new deragatory mark credit year company attempt collect debt national credit adjust address creditor contact xxxx xxxx xxxx xxxx xxxx xxxx xxxx xxxx ks xxxx xxxx xxxx list attempt contact,5
2020-06-15,"Credit reporting, credit repair services, or other personal consumer reports",Credit reporting,Problem with a credit reporting company's investigation into an existing problem,Their investigation did not fix an error on your report,"I recently found out that Section 623 states that the creditor can not continue to report it when disputed, unless they have proof to the contrary. Why I didn't receive documentation to such proof. I request to further clarify the company 's compliance with Metro2. I also demand this agency/company to provide verification of documents that you have reviewed. Otherwise, delete these accounts immediately.",,"EQUIFAX, INC.",DE,,,Consent provided,Web,2020-06-15,Closed with explanation,Yes,,3699970,recently find section state creditor continue report dispute proof contrary receive documentation proof request clarify company compliance demand agency company provide verification document review delete account immediately,0
2021-02-06,Checking or savings account,Checking account,Closing an account,Company closed your account,"On XX/XX/XXXX, I received a notice by text from USAA about an overdraft transfer from my primary account to my daughters account in the amount of {$990.00}, I check my accounts on my mobile app to see what's going on when I notice some fraud activity in the joint account I have with my daughter. I called USAA to let them know I need a fraud investigation due to the activity of fake IRS checks that were deposited to that account in the amounts of {$6500.00}, {$4500.00} and {$5500.00} and then were withdrawn from several atms in large amounts. I ask the representative how was someone allowed to withdraw {$800.00} at a time from several atms in the same day when I can't even withdraw more than {$400.00} in a single day but she answered she had no idea how that was done. The investor was submitted and I was told I had to wait about 45 days for the investigation to be complete. On XXXX XXXX XXXX noticed a {$990.00} charge pending from a XXXX  that I didn't authorize and called USAA to let them know the charges pending didn't come from me and to see if they can stop the money from coming out since it was pending, I was told that for whatever reason they can't stop pending XXXX payments but they will submit a fraud request on my behalf to start an investigation. On XXXX XX/XX/XXXX I check my account and notice a misc debt taken from my primary checking in the amount of {$6000.00}. I call USAA to ask about the misc debt and was told it was taken to cover the fraud from my daughters account. I didn't receive a phone call, text alert, email or letter in the mail from USAA about the the outcome of the investigation nor was I given any options on how I would like to take care of the debt. I was talked to on the phone like I was a criminal and so was my daughter. I spoke with 2 different ladies that day and they both treated me as if this was all me and my daughters fault, I was told she must have given out the information to someone. I told both ladies that how dare they insinuate that we didn't anything to help someone fraud our accounts. My XXXX payment along with my retirement payment was taken and my bills were still pending or needing to come out my checking account to be paid, neither representative acted as if they cared that the institution caused me financial hardship by taking my funds to cover a debt that wasn't my fault or my daughters. I ask the resolution team representative about what was in the investigation notes since I didn't receive any type of notice and her reply was she can't tell me because it's my daughter 's account although I'm a joint owner of the account, I say "" so USAA can take money from my primary checking account to cover the fraud debt but you can't give me any information from what's in the notes about the fraud investigation. After being frustrated with the representatives I have my daughter call and thats when I found out the fraud investigation didn't come back in her favor, although they see someone somewhere in TX was behind the fraud but because they called XXXX to see if her phone was hacked and XXXX said no they put her at fault as if she gave her banking information to someone to falsely uploaded some fake IRS checks to defraud the bank. I have yet to receive an answer on how someone was allowed to withdraw {$800.00} from an atm 11 times in one day, {$200.00}, {$480.00}, {$100.00} all in the same day from more than one bank when I can only withdraw {$400.00} in one day, and how is it that the activity wasn't pegged as fraud. On XXXX XX/XX/XXXX I was on my USAA mobile app and all my accounts had unavailable as the status, so I call USAA again to see what's going on, the representative said there were no notes in there and she forwarded my call to the resolution team, lady name XXXX was looking to see what's going on when she also said that the note was not clear to her on what's going on but it seems as if USAA was reserving their rights to not bank with me and that basically they have frozen all my accounts and I can't get my money until after 60 days of the account closing. I have bills still needing to be paid, I have no money and I have a household with kids to maintain. I got no warning from USAA before they took all I had and froze my money up. I have over {$7000.00} in my savings that I can't access right now, I had a lil over {$2000.00} in my checking that I can't access, my other daughters accounts were also closed out without notice to them as well. We all have our direct deposits going to USAA. If they already took money to cover the debt why freeze up all my money and close my accounts. I do all my banking with USAA to include my insurance on my property and vehicles not to mention I have banked with this institution for about 15 years and they never even gave me a courtesy phone call or email but the resolution representative did tell me they mailed a letter out to me on XXXX XX/XX/XXXX which I still have not received in the mail as of XXXX XX/XX/XXXX when I noticed my accounts were unavailable. I am a XXXX % XXXX veteran and I feel I have been taken advantage of an accused of frauding the institution where all of my assets are at. I have no money to survive off of for the month of XXXX. My funds should have been exempted from Debt collection via Automatic ProtectionsGovernment benefits like Social Security, XXXX Benefits, etc have automatic protections. The funds in my bank account are exempt because part of it was XXXX benefits and account can not be frozen even when there is a judgment against you.",Company believes it acted appropriately as authorized by contract or law,UNITED SERVICES AUTOMOBILE ASSOCIATION,MS,392XX,Servicemember,Consent provided,Web,2021-02-06,Closed with explanation,Yes,,4122583,xx xx xxxx receive notice text usaa overdraft transfer primary account daughter account check account mobile app go notice fraud activity joint account daughter call usaa let know need fraud investigation activity fake irs check deposit account amount withdraw atms large amount ask representative allow withdraw time atms day withdraw single day answer idea investor submit tell wait day investigation complete xxxx xxxx xxxx notice charge pende xxxx authorize call usaa let know charge pende come stop money come pende tell reason stop pende xxxx payment submit fraud request behalf start investigation xxxx xx xx xxxx check account notice misc debt take primary checking usaa ask misc debt tell take cover fraud daughter account receive phone text alert email letter mail usaa outcome investigation give option like care debt talk phone like criminal daughter speak different lady day treat daughter fault tell give information tell lady dare insinuate help fraud account xxxx payment retirement payment take bill pende need come checking account pay representative act care institution cause financial hardship take fund cover debt fault daughter ask resolution team representative investigation note receive type notice reply tell daughter account joint owner account usaa money primary checking account cover fraud debt information note fraud investigation frustrate representative daughter s find fraud investigation come favor tx fraud call xxxx phone hack xxxx say fault give banking information falsely upload fake irs check defraud bank receive answer allow withdraw atm time day day bank withdraw day activity peg fraud xxxx xx xx xxxx usaa mobile app account unavailable status usaa go representative say note forward resolution team lady xxxx look go say note clear go usaa reserve right bank basically freeze account money day account closing bill need pay money household kid maintain get warning usaa take freeze money saving access right lil checking access daughter account close notice direct deposit go usaa take money cover debt freeze money close account banking usaa include insurance property vehicle mention bank institution year give courtesy phone email resolution representative tell mail letter xxxx xx xx xxxx receive mail xxxx xx xx xxxx notice account unavailable xxxx xxxx veteran feel take advantage accuse fraude institution asset money survive month xxxx fund exempt debt collection automatic protectionsgovernment benefit like social security xxxx benefit etc automatic protection fund bank account exempt xxxx benefit account freeze judgment,1
2016-06-29,Credit card,,Rewards,,"In XXXX 2015, I signed up for a Frontier Credit Card. I was told that I would receive XXXX miles as a bonus for signing up for the card. They advised I could turn these into XXXX round trip flights. They advised on XXXX XXXX that I could just book the flight on my Frontier Credit Card, and when the miles where added they would issue a credit for the airline tickets. I have called for 2 months now and still do not have the miles into my account. They gave me a case number XXXX. I spoke to XXXX who stated she was a supervisor and she stated that it should have been credited. 
I believe that this a fraud. I was promised something and after paying a {$79.00} account fee the company refuses to give me the miles. 
My frequent flyer number is : XXXX. 
My credit card number is XXXX",Company has responded to the consumer and the CFPB and chooses not to provide a public response,BARCLAYS BANK DELAWARE,FL,320XX,,Consent provided,Web,2016-06-29,Closed with monetary relief,Yes,No,1987835,xxxx sign frontier credit card tell receive xxxx mile bonus sign card advise turn xxxx round trip flight advise xxxx xxxx book flight frontier credit card mile add issue credit airline ticket call month mile account give case number xxxx speak xxxx state supervisor state credit believe fraud promise pay account fee company refuse mile frequent flyer number xxxx credit card number xxxx,2
2018-11-24,Credit card or prepaid card,Store credit card,Getting a credit card,Application denied,"On XX/XX/2018, in obtaining and approving a car loan from XXXX I was provided with documents that show my credit score from XXXX indicating a score of XXXX which ranks higher than 97 percent of U.S. consumers. Copies of that score are attached hereto. 

On or about XX/XX/2018, I applied for a XXXX credit card and was denied due to race. I received a letter from Citibank / XXXX that indicated delinquent credit obligation. This is false as that was disputed with XXXX as the charges were reported as fraudulent. Copy of letter attached hereto. How can I have such a high score if that wasn't true? 

I have a credit score higher than most Americans and I was denied a credit card. This is shocking and can only be described as racial discrimination. I fought for my country and almost died only to be discriminated by Citibank and XXXX. Now, you know why veterans commit suicide because we have companies like Citibank and XXXX who perpetuate the reason.",Company has responded to the consumer and the CFPB and chooses not to provide a public response,"CITIBANK, N.A.",CA,900XX,,Consent provided,Web,2018-11-24,Closed with explanation,Yes,,3081744,xx obtain approve car loan xxxx provide document credit score xxxx indicate score xxxx rank high percent consumer copy score attach hereto xx apply xxxx credit card deny race receive letter citibank xxxx indicate delinquent credit obligation false dispute xxxx charge report fraudulent copy letter attach hereto high score true credit score high americans deny credit card shocking describe racial discrimination fight country die discriminate citibank xxxx know veteran commit suicide company like citibank xxxx perpetuate reason,3
