2017-09-24,Mortgage,Conventional home mortgage,Closing on a mortgage,,"I am a XXXX resident using PennyMac, based in XXXX as a lender to service a mortgage. I chose PennyMac before I left XXXX to move to XXXX, because of the company 's relationship with XXXX, with whom I had prior good mortgage referrals. I very much regret having chosen this company, which has caused several delays in closing, and which nearly cost me a thousand dollars in lost seller 's credit, until my agent gave them instructions on how to do their job. However, these annoyances are not my legal complaint.
On the week before we reserved a date for our house closing, assured by PennyMac ( "" PM '' ) that we could close on or beforeXX/XX/XXXX, I asked what specific power of attorney would be needed for my co-signer, my mother who lives out-of-state, to have me sign for her. My agent 's manager, who was covering for the agent who was out for a few days ( without telling me ), checked for a PM power of attorney template. Not finding one, she referred me to my title insurance company. I did this, and immediately forwarded a copy to PM to review and approve. On XX/XX/XXXX, the manager replied that she had forwarded the POA to her underwriter to do so. In the meantime, I sent a copy to my mother who paid to have it notarized and sent next-day to the title company for closing on XX/XX/XXXX The signed copy faxed to title and PM. On XX/XX/XXXX, as my mother was sending the notarized copy, PM contacted me to tell me that the underwriter refused to review the unsigned copy that they had received. After they received it, they would still require 24 hours before they would approve it.
Twenty four hours later, they declined to approve the POA. OnXX/XX/XXXX, they wrote XX/XX/XXXX POA must be fully executed prior to approval. Per Policy Procedure doc XXXX ( XXXX ) : # 1 Please provide a handwritten letter of explanation regardin the reason for the used of the Power of Attorney and relationship between parties.
# 2 The borrower ( s ) must indicate who will physically attend the signing.
My complaint against PM is that this policy is unreasonable on its face, and grossly unreasonable as applied in my particular case.
There is no rational reason for providing a "" handwritten letter '' as opposed to any other form of communication, including a signed typed letter. The policy does not specify who is to write the "" handwritten letter '' -- the individual seeking the POA, the other Buyer, or some other individual.
When the party seeking the POA lives out-of-state, hundreds of miles away, that is a self-evident reason for seeking a POA.
When the party seeking the POA is already documented in the company 's records as being the mother of the other Buyer, the information demanded is superfluous and should not be a condition of approval.
The POA reviewed designates the other Buyer as the one authorized to sign. Asking who will physically attend the signing serves no rational purpose and is implied on the face of the POA.
Finally, these "" surprise '' requirements, as trivial and unexpected as they are, were never shared with me after the POA was discussed with PM representatives and manager, until XX/XX/XXXX. Even had we provided what we believed the underwriter needed ( which as I note is ambiguous ), we were informed that the underwriter needs 24 hours to consider any document before giving approval. Thus, our promised closing date of XX/XX/XXXXhad to be rescheduled again.
I immediately informed PM that we would withdraw the POA, as it had cost us unacceptable delays in closing, and we could not afford further delays while we worked with the underwriter to figure out what exactly they needed to approve the document. We are trying to make moving arrangements, school transfer arrangements, work arrangements, utility transfer and property maintenance arrangements. The money my mother spent on notarizing and sending the document to the title company was wasted, and she was compelled to spend several hundred dollars to fly out to be physically present at the signing.
Please investigate the PM policy, including procedures how it is shared with the public, to determine if it puts an unreasonable burden on the consumer. Consumers at the late stage of the process of closing on a house are in a highly vulnerable position, and the mortgage company has a virtual monopoly over their customer at that point. I believe that PM is negligent in its application of its policies, which are themselves arbitrary and capricious.",,"PENNYMAC LOAN SERVICES, LLC.",VA,221XX,,Consent provided,Web,2017-09-24,Closed with explanation,Yes,,2682958,xxxx resident pennymac base xxxx lender service mortgage choose pennymac leave xxxx xxxx company relationship xxxx prior good mortgage referral regret having choose company cause delay closing nearly cost thousand dollar lose seller credit agent give instruction job annoyance legal complaint week reserve date house closing assure pennymac pm close beforexx xx xxxx ask specific power attorney need co signer mother live state sign agent manager cover agent day tell check pm power attorney template find refer title insurance company immediately forward copy pm review approve xx xx xxxx manager reply forward poa underwriter meantime send copy mother pay notarize send day title company close xx xx xxxx sign copy fax title pm xx xx xxxx mother send notarized copy pm contact tell underwriter refuse review unsigned copy receive receive require hour approve hour later decline approve poa onxx xx xxxx write xx xx xxxx poa fully execute prior approval policy procedure doc xxxx xxxx provide handwritten letter explanation regardin reason power attorney relationship party borrower s indicate physically attend signing complaint pm policy unreasonable face grossly unreasonable apply particular case rational reason provide handwritten letter oppose form communication include sign type letter policy specify write handwritten letter individual seek poa buyer individual party seek poa live state hundred mile away self evident reason seek poa party seek poa document company record mother buyer information demand superfluous condition approval poa review designate buyer authorize sign ask physically attend signing serve rational purpose imply face poa finally surprise requirement trivial unexpected share poa discuss pm representative manager xx xx xxxx provide believe underwriter need note ambiguous inform underwriter need hour consider document give approval promise closing date xx xx xxxxhad reschedule immediately inform pm withdraw poa cost unacceptable delay closing afford delay work underwriter figure exactly need approve document try moving arrangement school transfer arrangement work arrangement utility transfer property maintenance arrangement money mother spend notarize send document title company waste compel spend dollar fly physically present signing investigate pm policy include procedure share public determine put unreasonable burden consumer consumer late stage process close house highly vulnerable position mortgage company virtual monopoly customer point believe pm negligent application policy arbitrary capricious,1
2017-11-15,Student loan,Private student loan,Struggling to repay your loan,Can't get other flexible options for repaying your loan,"The student that I received was a pell grant based off low income and a XXXX XXXX totaling XXXX. The teacher that has taught me before at XXXX XXXX has done the same thing. She and her daughter have filed a high interest student loan and then cashed it. She has also spent a credit worth XXXX XXXX in a hour at XXXX on a XXXX  XXXX XXXX card. My other complaint is the classes I took? I am not advanced placement anything. I also took cad for basic tooling and I found cad for architecture in a software bin at my parents. 
I apologize for the squabble with my brother but I think you 'll find my case interesting if you pull my student I.d . And my recent drivers license. I know that the student id has XXXX eyes and hair. I have XXXX XXXX eyes and XXXX XXXX hair. I just think it 's probably my brothers revenge for his failed XXXX. At leads.",,"Navient Solutions, LLC.",OH,44646,,Consent provided,Web,2017-11-21,Closed with explanation,Yes,,2730369,student receive pell grant base low income xxxx xxxx total xxxx teacher teach xxxx xxxx thing daughter file high interest student loan cash spend credit worth xxxx xxxx hour xxxx xxxx xxxx xxxx card complaint class take advanced placement take cad basic tooling find cad architecture software bin parent apologize squabble brother think find case interesting pull student recent driver license know student d xxxx eye hair xxxx xxxx eye xxxx xxxx hair think probably brother revenge fail xxxx lead,6
2019-06-16,"Credit reporting, credit repair services, or other personal consumer reports",Credit reporting,Improper use of your report,Credit inquiries on your report that you don't recognize,"Upon reviewing my credit profile I found several un authorized inquiries. This one was done on XX/XX/2018. i have no recollection of this inquiry, and sent certified letters to both companies to have them removed over sixty days ago, bot it still remains.",Company has responded to the consumer and the CFPB and chooses not to provide a public response,SYNCHRONY FINANCIAL,TX,773XX,Servicemember,Consent provided,Web,2019-06-16,Closed with explanation,Yes,,3276999,review credit profile find un authorize inquiry xx recollection inquiry send certify letter company remove day ago bot remain,0
2015-05-21,Prepaid card,Gift or merchant card,Unauthorized transactions/trans. issues,,"I purchased XXXX pre-paid Visa cards at XXXX at XXXX XXXX grocery store for the total of {$1000.00} for my family as gifts each card totaled {$250.00}, i have had numerous calls to Visa who knows the cards were compromised and where, i have had no help from them on this issue!!, I filed an XXXX XXXX dispute for {$250.00} on XXXX of the pre-paid cards and won, leaving a balance of {$750.00} they owe me, they sent me a replacement card with a balance of {$55.00} on it? ( still owe me {$190.00} on that XXXX ) then my sister was able to use hers for {$110.00} until it was compromised and a thief stole the rest of the funds, she was told that she won that dispute but they did not send a replacement card or any way to get the funds back, they owe me {$570.00} plus fax and other expenses thru this process, they expect me to be able to reach an associate at their phone # XXXX ( XXXX ) XXXX never returning my calls ( even though i 've faxed all per tenant information and included all info they request on the answering service ), it has been a total nightmare and their hiding behind the veil of a large corporation that offers NO help or resolution to this issue, i have a paper trail and all receipts pertaining to this transaction and have had NO help, i 've called numerous people and have NO resolution.",Company chooses not to provide a public response,U.S. BANCORP,CO,801XX,,Consent provided,Web,2015-06-11,Closed with explanation,Yes,No,1386582,purchase xxxx pre pay visa card xxxx xxxx xxxx grocery store total family gift card total numerous call visa know card compromise help issue file xxxx xxxx dispute xxxx pre pay card win leave balance owe send replacement card balance owe xxxx sister able use compromise thief steal rest fund tell win dispute send replacement card way fund owe plus fax expense process expect able reach associate phone xxxx xxxx xxxx return call ve fax tenant information include info request answer service total nightmare hiding veil large corporation offer help resolution issue paper trail receipt pertain transaction help ve call numerous people resolution,2
2016-02-23,Credit reporting,,Unable to get credit report/credit score,Problem getting report or credit score,"it started with Transunion i 'm aware my score is well over a XXXX i 'm currently trying to refinance my home and dispute some items but creditor can not obtain a credit score from my Transunion file and previous disputed items have not been removed from other credit reporting agencies all my history is there but the score that was mailed off cant be honored, I went to court and the courts ordered XXXX home mortgage to reinstate my mortgage and then XXXX home mortgage offered to remove XXXX in debt from my home purchase which leaves it at XXXX with a monthly amount of XXXX please update and provide a Transunion score for my file please in reference to account no # XXXX",Company has responded to the consumer and the CFPB and chooses not to provide a public response,"TRANSUNION INTERMEDIATE HOLDINGS, INC.",OH,440XX,,Consent provided,Web,2016-02-23,Closed with explanation,Yes,No,1799667,start transunion m aware score xxxx m currently try refinance home dispute item creditor obtain credit score transunion file previous dispute item remove credit reporting agency history score mail not honor go court court order xxxx home mortgage reinstate mortgage xxxx home mortgage offer remove xxxx debt home purchase leave xxxx monthly xxxx update provide transunion score file reference account xxxx,6
2019-09-26,"Credit reporting, credit repair services, or other personal consumer reports",Credit reporting,Problem with a credit reporting company's investigation into an existing problem,Their investigation did not fix an error on your report,XXXX  HAVE REPORTED ME FOR AN ACCOUNT THAT I DID NOT OPEN AND IT'S CAUSING ME A HARDSHIP. TD BANK CONSUMER ID NUMBER XXXX,,TD BANK US HOLDING COMPANY,CA,937XX,,Consent provided,Web,2019-09-26,Closed with explanation,Yes,,3387728,xxxx report account open cause hardship td bank consumer d number xxxx,7
2016-10-12,Credit card,,Identity theft / Fraud / Embezzlement,,Paid the amount agreed. Contacted the company they said I honored our agreement but the have XXXX to report this to the credit bureau.,Company has responded to the consumer and the CFPB and chooses not to provide a public response,WELLS FARGO & COMPANY,GA,30038,,Consent provided,Web,2016-11-04,Closed with non-monetary relief,Yes,No,2156601,pay agree contact company say honor agreement xxxx report credit bureau,5
2018-11-08,Mortgage,Conventional home mortgage,Closing on a mortgage,,"XXXX XXXX XXXX is holding my payoff hostage and stating that even though I requested a payoff that was good through XX/XX/XXXX, and I closed on XX/XX/XXXX until I come up with another {$2400.00}. At the same time, they are telling me I am in default because I didn't pay my XX/XX/XXXX payment, that shouldn't even be due because I closed in XX/XX/XXXX for the refinance. They say that the reason I owe the money is because the escrow account was short, but I pay into the escrow more than enough for taxes and insurance each month, and on top of that, they won't provide me with an escrow analysis to show where my monies have gone.",,Ocwen Financial Corporation,GA,301XX,,Consent provided,Web,2018-11-08,Closed with explanation,Yes,,3069277,xxxx xxxx xxxx hold payoff hostage state request payoff good xx xx xxxx close xx xx xxxx come time tell default pay xx xx xxxx payment close xx xx xxxx refinance reason owe money escrow account short pay escrow taxis insurance month will provide escrow analysis monie go,6
2015-12-19,Credit reporting,,Incorrect information on credit report,Information is not mine,"Equifax reporting incorrect information. specifically, a negative XXXX XXXX account that is not mine thus impacting my credit score",,"EQUIFAX, INC.",MI,,Older American,Consent provided,Web,2015-12-19,Closed with explanation,Yes,No,1708493,equifax report incorrect information specifically negative xxxx xxxx account impact credit score,0
2015-12-15,Debt collection,I do not know,Communication tactics,Frequent or repeated calls,"I have received XXXX rude and obnoxious voice mails from a Company named National Principal Groups. They are actually yelling on the message stating they are looking for a Party who does not reside at my household. They state they are skip tracing and have the right to contact any phone numbers that are listed on file, and that they request a call back even if I do not have any information. I have called back after the XXXX voice mail received and left a message stating not to call my phone number again. I received another voice mail today and I called them back stating again, not to contact this phone number and they still asked for information on a party they are looking for. They have called XXXX, XXXX, and now XXXX. No one in my household owes any outstanding collection/debt and do not appreciate this company contacting our home.",,"National Principal Group, LLC",OH,440XX,,Consent provided,Web,2015-12-17,Closed with explanation,Yes,Yes,1697679,receive xxxx rude obnoxious voice mail company name national principal group actually yell message state look party reside household state skip trace right contact phone number list file request information call xxxx voice mail receive leave message state phone number receive voice mail today call state contact phone number ask information party look call xxxx xxxx xxxx household owe outstanding collection debt appreciate company contact home,4
2020-07-15,Mortgage,Conventional home mortgage,Applying for a mortgage or refinancing an existing mortgage,,"I contacted Quicken Loans to inquire about refinancing as I heard interest rates were very low during Covid19. Initially I was told they refinance the loan at 2 % less than my current interest rate. The required pulling my Credit and stated I would get a copy of the credit report, which DID NOT HAPPEN ... ... After submitting my financials, ( XXXX XXXX ) Quicken representative called me back and stated due to some sort of crazy NC Law, they could only lower by .75 %. I questioned if that would actually be saving anything and she stated including closing costs, it would save {$2300.00} long term and THEY WOULD REMOVE THE PMI MORTGAGE INSURANCE WITH OUT NEEDING ANY APPRAISAL. Mrs. XXXX stated by their comps in the area, the homes value would easily be above 20 % equity vs {$72000.00} currently owed on existing mortgage. After reviewing my 2019 tax return and business profit & loss statement, she felt the refinance should go through underwriting with no problem. I recieved a call from another member of the underwriting team 7-10 days later stating that they need another profit loss statement and additional tax forms from the 2019 filing. When I inquired why additional paperwork was needed, He stated it was almost impossible for SELF EMPLOYED Individuals to get approved for new loans or refinance due to the Covid19 Financial Crisis. At this point I felt the cards were obviously stacked against me, I asked the underwriter to stop the refinance and just take the PMI Mortgage Insurance off my current loan which I feel saves much more than {$2300.00} LONG TERM ... ... He directed me to go online to apply for PMI removal. When I logged into my account, I was pleased to see their website showed my outstanding loan {$72000.00} was well with in their guidelines to have the PMI removed. *** NOW I AM BEING TOLD I AN APPRAISAL IS REQUIRED BEFORE THEY WILL REMOVE PMI AND I MUST USE THEIR APPRAISER FOR A COST OF {$150.00}. * I feel it is fraudulent and misleading for Quicken to allow removal of the PMI if I take on the additional costs of letting them refinance the loan ( $ XXXX ) but they are unwilling to remove the PMI from original loan unless I Pay for an appraisal. It makes no sense that Quicken would be willing to remove the PMI no questions asked during a REFINANCE SITUATION because they state they already agree the homes value exceeds the PMI requirements, but when it comes to removing the PMI from the current loan I have with their company, they are stalling by requiring appraisal by their team member. I have always paid ahead on my mortgage, never missed a payment and have a XXXX  credit score. Until this transaction, I felt I was dealing with an upstanding company, having them try to take advantage of me because they could not make additional fees refinancing has made me reevaluate companies credibility.",,"Rocket Mortgage, LLC",NC,285XX,,Consent provided,Web,2020-07-27,Closed with explanation,Yes,,3746856,contact quicken loan inquire refinance hear interest rate low initially tell refinance loan current interest rate require pull credit state copy credit report happen submit financial xxxx xxxx quicken representative call state sort crazy nc law lower question actually save state include closing cost save long term remove pmi mortgage insurance need appraisal mrs xxxx state comp area home value easily equity vs currently owe exist mortgage review tax return business profit loss statement feel refinance underwriting problem recieve member underwriting team day later state need profit loss statement additional tax form filing inquire additional paperwork need state impossible self employ individual approve new loan refinance financial crisis point feel card obviously stack ask underwriter stop refinance pmi mortgage insurance current loan feel save long term direct online apply pmi removal log account pleased website show outstanding loan guideline pmi remove tell appraisal require remove pmi use appraiser cost feel fraudulent misleading quicken allow removal pmi additional cost let refinance loan xxxx unwilling remove pmi original loan pay appraisal make sense quicken willing remove pmi question ask refinance situation state agree home value exceed pmi requirement come remove pmi current loan company stall require appraisal team member pay ahead mortgage miss payment xxxx credit score transaction feel deal upstanding company have try advantage additional fee refinance reevaluate company credibility,6
2021-05-09,Checking or savings account,Checking account,Managing an account,Problem accessing account,"XXXX shut down the XXXX XXXX XXXX and has taken over the banking for the former customers of Simple. However, nearly all of the Simple customers, including myself, are unable to access our money because they failed to properly prepare for the transition and lied about the transition process. 

Several key XXXX activities by XXXX : Transition occurred XXXX night. XXXX knows that their customer service is closed over the weekend, but continued the buggy transition anyway. 

XXXX knew that this weekend is XXXX XXXX XXXX, yet they expect thousands of customes to spend their entire holiday on the phone for hours. 

XXXX hangs up on their customers. The ONLY way XXXX can resolve the problems is over the phone. However, I and many thousands of customers have called multiple times and were hung up on by XXXX XXXX XXXX. 

XXXX had several months to prepare for the transition. Simple gave us well advance notice of the transition and so did XXXX. XXXX assured Simple customers that the transition would be seemless and easy. However, it seems that XXXX lied and did not prepare at all. If I had not been mislead by XXXX, I would have transferred my money to a different Bank and closed my account beforehand. However, I LOVED Simple and how easy to use it was, that I stayed with them till the end. I and as every Simple customer was falsely led to believe that the transition would be easy. 

Also, XXXX sneakily automatically enrolled EVERY Simple Customer into receiving Paper Statements for a fee that can only be XXXX if one has access to their XXXX account and is then able to navigate a maze of account settings to disable the Paper Statements. However, it seems that XXXX knew that the transition would not be smooth, hence Simple Customers would not have accessto their accounts ; therefore, XXXX can charge us all fees because it is impossible for us to disable the Statements. This decision by XXXX seems quite intentional.",,BBVA FINANCIAL CORPORATION,CA,945XX,,Consent provided,Web,2021-05-09,Closed with explanation,Yes,,4363682,xxxx shut xxxx xxxx xxxx take banking customer simple nearly simple customer include unable access money fail properly prepare transition lie transition process key xxxx activity xxxx transition occur xxxx night xxxx know customer service close weekend continue buggy transition xxxx know weekend xxxx xxxx xxxx expect thousand custome spend entire holiday phone hour xxxx hang customer way xxxx resolve problem phone thousand customer call multiple time hang xxxx xxxx xxxx xxxx month prepare transition simple give advance notice transition xxxx xxxx assure simple customer transition seemless easy xxxx lie prepare mislead xxxx transfer money different bank close account love simple easy use stay till end simple customer falsely lead believe transition easy xxxx sneakily automatically enrol simple customer receive paper statement fee xxxx access xxxx account able navigate maze account setting disable paper statement xxxx know transition smooth simple customer accessto account xxxx charge fee impossible disable statement decision xxxx intentional,1
