2020-06-05,"Credit reporting, credit repair services, or other personal consumer reports",Credit reporting,Incorrect information on your report,Information belongs to someone else,"XX/XX/2020 XXXX XXXX XXXX XXXX XXXX XXXX XXXX, NC XXXX For XXXX/XXXX/ Experian & Attorney General/Consumer Finance/XXXX.

RE : Request to Block Unauthorized Collection Accounts and Inquiries from Credit Report under FCRA 605B I am a victim of identity theft. These fraudulent accounts were established using my personal Identification without my authorization. The information listed below, which appears on my credit report, is the result of identity theft on the affected accounts are listed below. 
This information is inaccurate and you have never sent any information to me indicating that the data Furnisher verified it as valid. I am stating to you that it is NOT. And you MUST REMOVE IT IMMEDIATELY! 
You must provide documentation as of its accuracy or remove it immediately without prejudice. 
XXXX ACCT : XXXX XXXX : {$130.00} XXXX  XXXX XXXX ACCT : XXXX XXXX : {$250.00} XXXX XXXX XXXX XXXX ACCT : XXXX XXXX : {$500.00} XXXX XXXX XXXX XXXX ACCT : XXXX XXXX : {$630.00} XXXX XXXX XXXX ACCT : XXXX AMT : {$2300.00} Also, the following unauthorized Credit Inquiries will be removed immediately without prejudice:7 XXXX  XXXX XX/XX/2020 XXXX XXXX XXXX XXXX XX/XX/2020 I have enclosed my FTC Identity Theft Report showing the fraudulent items. 
I have continuously been in contact with XXXX, Ex, and XXXX via the CFPB. Investigations have been continuously, with previous verdicts not in my favor from XXXX, XXXX  and Experian, However, XXXX  ( which is the Bureau that previously leaked millions on Consumers information and was the sole target of one of the largest data breaches in history ), has not complied and WILL NOT comply with this request. XXXX  and Experian all seem to gloss over my request with pleasure. 
This is again a demand to remove and block such information from the report in question. 
Please block this information from my credit report, as directed by section 605B of the Fair Credit Reporting Act, and notify all furnishers of this information. 


I appreciate your prompt attention to this matter, and await your reply. 
Sincerely, XXXX XXXX XX/XX/2020",Company has responded to the consumer and the CFPB and chooses not to provide a public response,Experian Information Solutions Inc.,NC,282XX,Servicemember,Consent provided,Web,2020-06-05,Closed with explanation,Yes,,3685228,xx xxxx xxxx xxxx xxxx xxxx xxxx xxxx nc xxxx xxxx experian attorney general consumer finance xxxx request block unauthorized collection account inquiry credit report fcra victim identity theft fraudulent account establish personal identification authorization information list appear credit report result identity theft affected account list information inaccurate send information indicate datum furnisher verify valid state remove immediately provide documentation accuracy remove immediately prejudice xxxx acct xxxx xxxx xxxx xxxx xxxx acct xxxx xxxx xxxx xxxx xxxx xxxx acct xxxx xxxx xxxx xxxx xxxx xxxx acct xxxx xxxx xxxx xxxx xxxx acct xxxx amt follow unauthorized credit inquiry remove immediately xxxx xxxx xx xxxx xxxx xxxx xxxx xx enclose ftc identity theft report show fraudulent item continuously contact xxxx ex xxxx cfpb investigation continuously previous verdict favor xxxx xxxx experian xxxx bureau previously leak million consumer information sole target large data breach history comply comply request xxxx experian gloss request pleasure demand remove block information report question block information credit report direct section fair credit reporting act notify furnisher information appreciate prompt attention matter await reply sincerely xxxx xxxx xx,1
2017-04-21,Credit reporting,,Incorrect information on credit report,Information is not mine,"In  XXXX  of    2017 I re ceived my credit report and found there were  XXXX  collections being report by   XXXX   XXXX   for the amount of  XXXX  and  XXXX . Upon placing a call with them i was told that these account were in collection for  XXXX   XXXX . The young lady on the phone gave me the addresses of both accounts. This is when I discovered that someone had stolen my identity. I filled out a forgery affidavit, had it notarized and made a police report. All of this information was sent into the credit report, and to   XXXX   XXXX   as well. all of this took place on  XXXX / XXXX  /2017.  It has been over a month and no one will tell me anything as to why these accounts are still reporting on my credit bureau.",,"EQUIFAX, INC.",IL,605XX,,Consent provided,Web,2017-04-21,Closed with explanation,Yes,No,2447354,xxxx ceive credit report find xxxx collection report xxxx xxxx xxxx xxxx place tell account collection xxxx xxxx young lady phone give address account discover steal identity fill forgery affidavit notarize police report information send credit report xxxx xxxx take place xxxx xxxx month tell account report credit bureau,7
2021-03-20,"Credit reporting, credit repair services, or other personal consumer reports",Credit reporting,Incorrect information on your report,Public record information inaccurate,"There are chapter XXXX bankruptcies on my credit and two accounts that do not belong to me I have contacted the court regarding this they are saying this is not verifiable and these are not mine that is why I am calling the courts trying to see what is going on. I have been writing to XXXX  Transunion and XXXX  regarding these and there has been nothing happening this has been a year and a half. 

Account Name : XXXX XXXX Account Number : XXXX Account Name : XXXX Account Number : XXXX Account Name : U.S. XXXX COURT Account Number : XXXX",Company has responded to the consumer and the CFPB and chooses not to provide a public response,"TRANSUNION INTERMEDIATE HOLDINGS, INC.",CA,916XX,,Consent provided,Web,2021-03-20,Closed with explanation,Yes,,4230245,chapter xxxx bankruptcy credit account belong contact court say verifiable call court try go write xxxx transunion xxxx happen year half account xxxx xxxx account number xxxx account xxxx account number xxxx account xxxx court account number xxxx,5
2020-06-19,"Credit reporting, credit repair services, or other personal consumer reports",Credit reporting,Incorrect information on your report,Information belongs to someone else,"I had my credit ran today XX/XX/20 because I'm trying to refinance my house but I was told I would not be able to do so because of an account from XXXX/XXXX  reflecting badly on my credit report. This account does not belong to me ; I didn't even know it was on my credit report before today because I never opened it and I did not give anyone permission to open it in my name. I am not affiliated to that company in any way nor did I have any written/verbal contract with them. I did not benefit anything from this account such as money, goods, services or any other benefit and I never made parents towards this account. I have already filed a police report regarding this unauthorized account. I have filed this report the best of my knowledge.",Company has responded to the consumer and the CFPB and chooses not to provide a public response,Experian Information Solutions Inc.,CA,902XX,,Consent provided,Web,2020-06-19,Closed with explanation,Yes,,3707436,credit run today xx try refinance house tell able account xxxx xxxx reflect badly credit report account belong know credit report today open permission open affiliate company way write verbal contract benefit account money good service benefit parent account file police report unauthorized account file report good knowledge,6
2017-05-17,"Credit reporting, credit repair services, or other personal consumer reports",Credit reporting,Incorrect information on your report,Information belongs to someone else,XXXX   XXXX   XXXX   client  XXXX   XXXX  ( formerly  XXXX  ) is an identity theft victim. Someone used her information to apply for a credit card with  XXXX   XXXX   A  dispute of the application was submitted to  XXXX   XXXX   XXXX / XXXX / XXXX  certified mail with return receipt. In  XXXX   XXXX  a review of her credit reports was conducted and the  XXXX   XXXX  inquiry was still listed. Contact was made with  XXXX   XXXX  and we were advised that by  XXXX  the inquiry would be removed. A check of the credit report was done again in  XXXX   XXXX  and the  XXXX   XXXX  inquiry was still listed with  XXXX   XXXX . A formal dispute was sent electronically to  XXXX   XXXX   XXXX / XXXX / XXXX  ; as of  XXXX / XXXX / XXXX   XXXX   XXXX  confirmed  XXXX   XXXX  is reporting the inquiry as valid. At this point there are now several violations of the FCRA from Both  XXXX   XXXX  and  XXXX   XXXX .,,"Colony Brands, Inc.",IL,625XX,,Consent provided,Web,2017-05-18,Closed with explanation,Yes,,2487596,xxxx xxxx xxxx client xxxx xxxx xxxx identity theft victim information apply credit card xxxx xxxx dispute application submit xxxx xxxx xxxx xxxx xxxx certify mail return receipt xxxx xxxx review credit report conduct xxxx xxxx inquiry list contact xxxx xxxx advise xxxx inquiry remove check credit report xxxx xxxx xxxx xxxx inquiry list xxxx xxxx formal dispute send electronically xxxx xxxx xxxx xxxx xxxx xxxx xxxx xxxx xxxx xxxx confirm xxxx xxxx report inquiry valid point violation fcra xxxx xxxx xxxx xxxx,3
2020-03-22,Mortgage,Other type of mortgage,Struggling to pay mortgage,,"I'm a victim of an illegal foreclosure. 

I'm supposed to evicted on XX/XX/2020 Attached is the illegal process that have taken place. Also attached is sheriff deed and statements from the attorney 's. No one will submit proof that my house was paid for at auction or any time afterward. The only statements that the attorney 's and sheriff will say is that a highest bidder won the bid. I've requested proof from the sheriff and the bidder that my house was paid for. So far as up to date no one has submitted proof or signed a certified affidavit to verify that my house was paid for.",,"BANK OF NEW YORK MELLON CORPORATION, THE",NJ,072XX,,Consent provided,Web,2020-03-24,Closed with explanation,Yes,,3575826,victim illegal foreclosure suppose evict xx attach illegal process take place attach sheriff deed statement attorney submit proof house pay auction time afterward statement attorney sheriff high bidder win bid request proof sheriff bidder house pay far date submit proof sign certified affidavit verify house pay,6
2018-09-14,Debt collection,Other debt,Attempts to collect debt not owed,Debt was result of identity theft,"I checked my credit report and saw a fraudulent account named Berlin-wheeler-ks, that was opened on XX/XX/2017. I have disputed the above with all three bureaus. The above mentioned is still being reported as a negative account trying to collect funds in the amount of {$98.00}. This is not my account and under the Fair Credit Reporting Act, this fraudulent account needs to be removed. The company I have hired to handle this issue, has recently informed me that an identity theft affidavit has just been sent off.",Company has responded to the consumer and the CFPB and chooses not to provide a public response,"Berlin-Wheeler, Inc. (Kansas)",GA,309XX,Servicemember,Consent provided,Web,2018-09-15,Closed with explanation,Yes,,3019901,check credit report see fraudulent account name berlin wheeler k open xx dispute bureau mention report negative account try collect fund account fair credit reporting act fraudulent account need remove company hire handle issue recently inform identity theft affidavit send,7
2020-11-30,Debt collection,Medical debt,Written notification about debt,Didn't receive enough information to verify debt,"On XX/XX/XXXX, I received a letter stating that I had unpaid debt from a 3rd party debt collector from a medical bill. The amount owed was {$46.00} from XXXX XXXX XXXX which was passed to Frost-Arnett, the debt collection agency. However, I had not known about this bill because I was not told about this payment due. So I contacted the company, the same day I got the letter, asking for verification and what had happened. I was told that in XXXX I was billed that amount. However, I remember that day and my doctor never told me about any bills to pay or I was never billed that amount. There was no phone call, email, or actual mail saying that I needed to pay. I even have voicemails going back to XXXX with no one contacting me. I lived in the same place from almost 7 months, until XXXX when I moved back to California, so I should have received a letter by that time. 
Until XXXX, when this letter came in. So I was really confused, and in that same phone call, asked them to send me an email confirmation the information needed. I made a follow up call after some thought to understand what would happen to me if I did not pay the bill or how to dispute the claim, then they hung up on me without giving any clear answers. 
However it has been 6 days since that day, today is XX/XX/XXXX. I understand there was a holiday in between and they may only respond during business days. But even excluding those, they had 2 days to respond.",,Frost-Arnett Company,CA,905XX,,Consent provided,Web,2020-11-30,Closed with explanation,Yes,,3980509,xx xx xxxx receive letter state unpaid debt party debt collector medical bill owe xxxx xxxx xxxx pass frost arnett debt collection agency know bill tell payment contact company day get letter ask verification happen tell xxxx bill remember day doctor tell bill pay bill phone email actual mail say need pay voicemail go xxxx contact live place month xxxx move california receive letter time xxxx letter come confused phone ask send email confirmation information need follow thought understand happen pay bill dispute claim hang give clear answer day day today xx xx xxxx understand holiday respond business day exclude day respond,5
2018-06-11,"Credit reporting, credit repair services, or other personal consumer reports",Credit reporting,Problem with a credit reporting company's investigation into an existing problem,Their investigation did not fix an error on your report,"Lexis Nexis XXXX XXXX XXXXXXXX XXXX, GA XXXX RE : Social Security Number : ********** To Whom It May Concern : In your letter dated XX/XX/2018, page 2 you acknowledge that under the FCRA that I have the right to request a description of the procedure used to determine the accuracy and completeness of disputed information. 

I am requesting the exact method of verification used considering Bankruptcy Rule 9037 ( a ). 

REDACTED FILINGS. Unless the court orders otherwise, in an electronic or paper filing made with the court that contains an individual 's social-security number, taxpayer identification number, or birth date, the name of an individual, other than the debtor, known to be and identified as a minor, or a financial-account number, a party or nonparty making the filing may include only : ( 1 ) the last four digits of the social-security number and taxpayer-identification number ; ( 2 ) the year of the individual 's birth ; ( 3 ) the minor 's initials ; and ( 4 ) the last four digits of the financial-account number.

Please note : You may not surmise that just because a name, partial address, partial account number, partial SS number, generation ( Jr., Sr. ), and or the 2nd or 3rd generation etc. is accurate. 

Therefore, based upon Bankruptcy rule 9037a above, the information many not be verified based upon assumptions.

Failure to respond satisfactorily with a deletion from your records within 30 days of receipt of this certified letter may result in a small claims action against your company, seeking {$1000.00} per violation for : 1. ) Defamation 2. ) Negligent Enablement of Identity Fraud 3. ) Violations of the Fair Credit Reporting Act My contact information is as follows : Please be aware that dependent upon your response, I may be detailing any potential issues with your company via an online public press release, including documentation of any potential small claims action.",,LEXISNEXIS,OH,44039,,Consent provided,Web,2018-06-11,Closed with explanation,Yes,,2932392,lexi nexis xxxx xxxx xxxxxxxx xxxx ga xxxx social security number concern letter date xx page acknowledge fcra right request description procedure determine accuracy completeness dispute information request exact method verification consider bankruptcy rule redact filing court order electronic paper filing court contain individual social security number taxpayer identification number birth date individual debtor know identify minor financial account number party nonparty make filing include digit social security number taxpayer identification number year individual birth minor initial digit financial account number note surmise partial address partial account number partial ss number generation jr sr generation etc accurate base bankruptcy rule information verify base assumption failure respond satisfactorily deletion record day receipt certify letter result small claim action company seek violation defamation negligent enablement identity fraud violation fair credit reporting act contact information follow aware dependent response detail potential issue company online public press release include documentation potential small claim action,3
2018-06-24,Checking or savings account,Checking account,Problem caused by your funds being low,Overdrafts and overdraft fees,"I was nearly XXXX in a XXXX XXXX XX/XX/2018. During recovery in the hospital I failed to in sure the funds in my bank of America account were sufficient. While all my deposits went to my XXXX XXXX checking account, all of my withdrawals came out of my Bank of America checking account. Bank of America charge nearly {$500.00} in overdraft fees, and agreed to waive {$140.00} of those fees due to my incident accident. At that time I transferred {$1500.00} to cover all late payments and fees. Bank of America immediately with Drew the farthest from my XXXX XXXX checking account, But they held nearly the entire transfer ( pending ) for seven full days leaving me no access to the funds whatsoever causing exponentially higher fees from every single credit card I have on a daily basis as they re-tried/allowed retrial withdrawal and reversal the payment over and over charging {$35.00} overdraft fees to my checking account each time as well as a {$25.00} return payment fee to the credit card requesting the withdrawal. This math equals : {$35.00} + {$25.00} x 6 credit cards x 6 withdrawal attempts each within 1 week. This occurred after spending 4 hours on the phone with multiple levels of Bank of America supervisors is trying to solve the issue. My former complaint was over around {$260.00}. I know Im complaining over nearly {$1000.00} in overdraft fees charged after Bank of America America knew the full details of the severity of my near XXXX XXXX and the lenght, XXXX, and medical cost of that rehabilitation. A representative from Bank of America left me a voicemail on my cell phone around XXXX XXXX, and asked me to call him back at a extension number which I now realize was fake. Their social media department also sent me two separate links asking me to provide personal information, these links were both also fake. I assume this is an attempt by Bank of America to create fake evidence that they have attempted to resolve this with me. They have done absolutely nothing of the sort. I have spent nearly 72 talking hours on the phone with every financial institution Im connected to trying to solve this issue, which I have the funds to solve, but Bank of America has completely lost their mind with their automated theft machine that governs their customers checking accounts.",Company has responded to the consumer and the CFPB and chooses not to provide a public response,"BANK OF AMERICA, NATIONAL ASSOCIATION",MN,,,Consent provided,Web,2018-06-24,Closed with monetary relief,Yes,,2944563,nearly xxxx xxxx xxxx xx recovery hospital fail sure fund bank america account sufficient deposit go xxxx xxxx check account withdrawal come bank america checking account bank america charge nearly overdraft fee agree waive fee incident accident time transfer cover late payment fee bank america immediately draw farth xxxx xxxx check account hold nearly entire transfer pende seven day leave access fund whatsoever cause exponentially high fee single credit card daily basis try allow retrial withdrawal reversal payment charge overdraft fee checking account time return payment fee credit card request withdrawal math equal x credit card x withdrawal attempt week occur spend hour phone multiple level bank america supervisors try solve issue complaint know m complain nearly overdraft fee charge bank america america know detail severity near xxxx xxxx lenght xxxx medical cost rehabilitation representative bank america leave voicemail cell phone xxxx xxxx ask extension number realize fake social medium department send separate link ask provide personal information link fake assume attempt bank america create fake evidence attempt resolve absolutely sort spend nearly talk hour phone financial institution m connected try solve issue fund solve bank america completely lose mind automate theft machine govern customer check account,1
